{
  "id": "geo.slate.layered.v1",
  "display_name": "Layered Slate",
  "family": "geological",
  "kind": "tileable-surface",
  "version": 1,
  "author": "elemental-ui contributors",
  "license": "GPL-3.0-only",
  "seed": 83402,
  "physical_tile_mm": 240,
  "parameters": {
    "base_color_rgb": [
      57,
      61,
      64
    ],
    "roughness": 0.78,
    "height_mm": 1.2,
    "grain": 2.2,
    "weathering": 0.18
  },
  "references": [],
  "status": "prototype"
}
